{
  "id": "agra_attraction_historical_10",
  "type": "attraction",
  "destinationId": "agra",
  "name": "Agra Attraction HISTORICAL 10",
  "category": "historical",
  "coordinates": {
    "latitude": 27.2017,
    "longitude": 78.0331
  },
  "openingHours": "09:00 AM - 06:00 PM",
  "closingDays": [
    "Monday"
  ],
  "difficulty": "medium",
  "budgetCategory": "mid",
  "familyFriendly": false,
  "coupleFriendly": true,
  "soloFriendly": true,
  "photographyScore": 5,
  "adventureScore": 25,
  "historicalScore": 0,
  "edges": [
    {
      "type": "route",
      "target": "agra_attraction_beach_1",
      "weight": 0.8,
      "confidence": 0.9
    }
  ],
  "plannerHints": {
    "idealVisitOrder": 10,
    "avoidWeekend": false,
    "visitBefore": "evening",
    "combineWith": [
      "agra_attraction_beach_1"
    ]
  },
  "plannerScore": {
    "budget": 0,
    "luxury": 30,
    "family": 0,
    "solo": 15,
    "photography": 5
  },
  "weatherProfile": {
    "sunny": 90,
    "rain": 20,
    "winter": 80,
    "summer": 70
  },
  "crowdProfile": {
    "Monday": 30,
    "Saturday": 85,
    "Morning": 40,
    "Evening": 75
  },
  "estimatedSpend": {
    "budget": 50,
    "mid": 250,
    "luxury": 1000
  },
  "insights": [
    "Great view in the afternoon",
    "Highly recommended by guide books."
  ],
  "metadata": {
    "customInfo": "RC1 Seeding"
  },
  "version": "1.0.0",
  "updatedAt": "2026-07-15T12:00:00Z",
  "verifiedAt": "2026-07-15T12:00:00Z",
  "tags": [
    "historical",
    "popular",
    "agra"
  ],
  "sources": [
    "Local travel guide"
  ],
  "confidence": 0.95
}