{
  "id": "munnar_attraction_market_5",
  "type": "attraction",
  "destinationId": "munnar",
  "name": "Munnar Attraction MARKET 5",
  "category": "market",
  "coordinates": {
    "latitude": 10.0889,
    "longitude": 77.0595
  },
  "openingHours": "09:00 AM - 06:00 PM",
  "closingDays": [
    "Monday"
  ],
  "difficulty": "easy",
  "budgetCategory": "budget",
  "familyFriendly": false,
  "coupleFriendly": true,
  "soloFriendly": true,
  "photographyScore": 75,
  "adventureScore": 85,
  "historicalScore": 75,
  "edges": [
    {
      "type": "route",
      "target": "munnar_attraction_beach_6",
      "weight": 0.8,
      "confidence": 0.9
    }
  ],
  "plannerHints": {
    "idealVisitOrder": 5,
    "avoidWeekend": false,
    "visitBefore": "morning",
    "combineWith": [
      "munnar_attraction_beach_6"
    ]
  },
  "plannerScore": {
    "budget": 65,
    "luxury": 85,
    "family": 75,
    "solo": 75,
    "photography": 75
  },
  "weatherProfile": {
    "sunny": 90,
    "rain": 20,
    "winter": 80,
    "summer": 70
  },
  "crowdProfile": {
    "Monday": 30,
    "Saturday": 85,
    "Morning": 40,
    "Evening": 75
  },
  "estimatedSpend": {
    "budget": 100,
    "mid": 300,
    "luxury": 1200
  },
  "insights": [
    "Great view in the morning",
    "Highly recommended by guide books."
  ],
  "metadata": {
    "customInfo": "RC1 Seeding"
  },
  "version": "1.0.0",
  "updatedAt": "2026-07-15T12:00:00Z",
  "verifiedAt": "2026-07-15T12:00:00Z",
  "tags": [
    "market",
    "popular",
    "munnar"
  ],
  "sources": [
    "Local travel guide"
  ],
  "confidence": 0.95
}