{
  "id": "varanasi_attraction_market_3",
  "type": "attraction",
  "destinationId": "varanasi",
  "name": "Varanasi Attraction MARKET 3",
  "category": "market",
  "coordinates": {
    "latitude": 25.3076,
    "longitude": 82.9639
  },
  "openingHours": "09:00 AM - 06:00 PM",
  "closingDays": [
    "Monday"
  ],
  "difficulty": "hard",
  "budgetCategory": "luxury",
  "familyFriendly": true,
  "coupleFriendly": true,
  "soloFriendly": true,
  "photographyScore": 63,
  "adventureScore": 69,
  "historicalScore": 65,
  "edges": [
    {
      "type": "route",
      "target": "varanasi_attraction_beach_4",
      "weight": 0.8,
      "confidence": 0.9
    }
  ],
  "plannerHints": {
    "idealVisitOrder": 3,
    "avoidWeekend": true,
    "visitBefore": "morning",
    "combineWith": [
      "varanasi_attraction_beach_4"
    ]
  },
  "plannerScore": {
    "budget": 51,
    "luxury": 67,
    "family": 65,
    "solo": 59,
    "photography": 63
  },
  "weatherProfile": {
    "sunny": 90,
    "rain": 20,
    "winter": 80,
    "summer": 70
  },
  "crowdProfile": {
    "Monday": 30,
    "Saturday": 85,
    "Morning": 40,
    "Evening": 75
  },
  "estimatedSpend": {
    "budget": 100,
    "mid": 300,
    "luxury": 1200
  },
  "insights": [
    "Great view in the morning",
    "Highly recommended by guide books."
  ],
  "metadata": {
    "customInfo": "RC1 Seeding"
  },
  "version": "1.0.0",
  "updatedAt": "2026-07-15T12:00:00Z",
  "verifiedAt": "2026-07-15T12:00:00Z",
  "tags": [
    "market",
    "popular",
    "varanasi"
  ],
  "sources": [
    "Local travel guide"
  ],
  "confidence": 0.95
}